{"$schema":"https://github.com/itdojp/private-match-protocol/raw/main/schema/pet-public-result-field-policy.v0.3.schema.json","artifact_status":"experimental","coordinator_visible_normalized_paths":["authoritative_context.initial_state.accepted_result_presence.party_a","authoritative_context.initial_state.accepted_result_presence.party_b","authoritative_context.initial_state.proposed_result_presence.party_a","authoritative_context.initial_state.proposed_result_presence.party_b","authoritative_context.initial_state.result_state","authoritative_context.initial_state.result_acknowledgment_bindings.party_a.normalized_acknowledgment_status","authoritative_context.initial_state.result_acknowledgment_bindings.party_b.normalized_acknowledgment_status"],"decision_vocabulary":["MATCH","NO_MATCH","INDETERMINATE"],"metadata_string_policy":{"arbitrary_value_global_scanning":"prohibited","schema_valid_metadata_may_equal_decision_vocabulary":true,"substring_matching":"prohibited"},"policy_digest":"sha256:a7dc0d49e9f6fdd3bb25ebdf1583727dcf28fb0d052262a0a11257023f0603e9","prohibited_public_paths":["authoritative_context.initial_state.party_local_result","evidence_hooks.party_local_result","presented_operation.party_a_result","presented_operation.party_b_result","presented_operation.party_results","product_handoff_input.synthetic_conformance_observer","public_audit_projection.synthetic_conformance_observer"],"prohibited_result_field_names":["bilateral_result","credential","exact_count","local_result","matching_element","party_a_result","party_b_result","party_local_result","party_results","plaintext_result","private_input","raw_grant","result_value"],"public_surfaces":["authoritative_context.initial_state","presented_operation","product_handoff_input","evidence_hooks","public_audit_projection"],"record_type":"pet-public-result-field-policy","schema_version":"0.3","synthetic_observer":{"allowed_decision_paths":["synthetic_conformance_observer.party_local_result_observations.party_a","synthetic_conformance_observer.party_local_result_observations.party_b"],"coordinator_visible":false,"evidence_exported":false,"product_port_input":false,"surface":"synthetic_conformance_observer","visibility":"synthetic-global-observer"}}
